<!ELEMENT StoreItems (Item*)>
        <!ELEMENT Item (Name, Price, Quantity)>
        <!ELEMENT Name (#PCDATA)>
        <!ELEMENT Price (#PCDATA)>
        <!ELEMENT Quantity (#PCDATA)>